<?xml version="1.0" encoding="utf-8"?>

<pedido xmlns:xsi="http://w3.org/2001/XMLSchema-instance"
         xsi:noNamespaceSchemaLocation="Practica1.xsd">   


	<nombre_cliente>
		<nombre> Guillermo</nombre>
		<primer_apellido>Linares</primer_apellido>
		<segundo_apellido>Larrea</segundo_apellido>
	</nombre_cliente>
	<articulos>
		<articulo cantidad="2">Pantalon</articulo>
		<articulo cantidad="1">Camisa</articulo>
		<articulo cantidad="3">Sudadera</articulo>
		<articulo cantidad="2">Calcetines</articulo>
	</articulos>
	<direccion>
		<calle>C/ Manuel Benitez el Cordobés</calle>
		<numero>4</numero>
		<portal>A</portal>
		<planta>2</planta>
		<codigo_postal>14005</codigo_postal>
		<provincia>Cordoba</provincia>
	</direccion>
</pedido>
